{
  "control": "graphx",
  "credentials": [],
  "executable": "graphx-generator",
  "execution": [
    "container",
    "native"
  ],
  "id": "sample.source",
  "image": "graphx-design/runtime@sha256:09486a2ac3d5398b1bb25e807db55c4954971f306b94e55498ee30b6f02cda8c",
  "observation": "graphx",
  "parameters": {
    "interval_ms": {
      "default": 500,
      "maximum": 60000,
      "minimum": 1,
      "type": "integer"
    },
    "max_messages": {
      "default": 20,
      "maximum": 1000000,
      "minimum": 1,
      "type": "integer"
    }
  },
  "ports": {
    "samples": {
      "default_port": null,
      "direction": "output",
      "encoding": "graphx",
      "feedback": false,
      "listener": false,
      "max_connections": 1,
      "min_connections": 1,
      "schema": "Sample",
      "transports": [
        "tcp",
        "shared_memory"
      ]
    }
  },
  "readiness": {
    "kind": "local-bound",
    "timeout_ms": 30000
  },
  "resources": {
    "memory_bytes": 134217728,
    "pids": 64
  },
  "revision": 1,
  "template": "node-v1"
}
